{
  "metadata": {
    "name": "sample_floorplan.skp",
    "unit": "mm",
    "scale": 1.0,
    "created_at": "2026-07-28T12:00:00Z",
    "updated_at": "2026-07-28T12:00:00Z"
  },
  "walls": [
    { "id": "w_1", "start": { "x": 0, "y": 0 }, "end": { "x": 8000, "y": 0 }, "thickness": 250, "height": 2800, "layer": "Walls" },
    { "id": "w_2", "start": { "x": 8000, "y": 0 }, "end": { "x": 8000, "y": 6000 }, "thickness": 250, "height": 2800, "layer": "Walls" },
    { "id": "w_3", "start": { "x": 8000, "y": 6000 }, "end": { "x": 0, "y": 6000 }, "thickness": 250, "height": 2800, "layer": "Walls" },
    { "id": "w_4", "start": { "x": 0, "y": 6000 }, "end": { "x": 0, "y": 0 }, "thickness": 250, "height": 2800, "layer": "Walls" },
    { "id": "w_5", "start": { "x": 4500, "y": 0 }, "end": { "x": 4500, "y": 6000 }, "thickness": 150, "height": 2800, "layer": "Walls" }
  ],
  "doors": [
    { "id": "d_1", "wallId": "w_3", "position": 0.2, "width": 900, "height": 2100, "hand": "left", "direction": "in", "layer": "Doors" },
    { "id": "d_2", "wallId": "w_5", "position": 0.4, "width": 850, "height": 2100, "hand": "right", "direction": "in", "layer": "Doors" }
  ],
  "windows": [
    { "id": "win_1", "wallId": "w_1", "position": 0.3, "width": 1500, "height": 1200, "elevation": 900, "layer": "Windows" },
    { "id": "win_2", "wallId": "w_2", "position": 0.5, "width": 1200, "height": 1200, "elevation": 900, "layer": "Windows" }
  ],
  "rooms": [
    {
      "id": "room_1",
      "name": "Main Hall",
      "points": [
        { "x": 0, "y": 0 },
        { "x": 4500, "y": 0 },
        { "x": 4500, "y": 6000 },
        { "x": 0, "y": 6000 }
      ],
      "area": 27.0,
      "layer": "Rooms"
    },
    {
      "id": "room_2",
      "name": "Office",
      "points": [
        { "x": 4500, "y": 0 },
        { "x": 8000, "y": 0 },
        { "x": 8000, "y": 6000 },
        { "x": 4500, "y": 6000 }
      ],
      "area": 21.0,
      "layer": "Rooms"
    }
  ]
}
